movieId,title,avgVote,releaseYear,genres,plot
34016,She's Out of My League,6.100000,2010,Comedy:Romance,"A lovable but insecure airport security agent navigates the ups and downs of romance when he unexpectedly wins the heart of a stunning and successful woman, leading to comedic misadventures that challenge his self-worth and their unlikely connection."
34179,14 Blades,6.500000,2010,Action:Drama:Thriller,"In a treacherous world of political intrigue and betrayal, a skilled imperial guard must use his formidable martial arts abilities and cunning to reclaim stolen secrets and protect the kingdom from a looming threat."
34182,Confucius,5.600000,2010,Drama:History,"In ancient China, a brilliant philosopher navigates the tumultuous political landscape while imparting timeless wisdom and ethical teachings that aim to transform society."
34335,Nine Dead,6.100000,2010,Crime:Drama:Horror:Suspense:Thriller,"In a chilling game of survival, nine strangers awaken in a mysterious location, forced to confront their dark pasts as they become entangled in a deadly scheme orchestrated by an unseen predator."
34803,Death at a Funeral,6.100000,2010,Comedy,"As a family gathers to mourn their father's passing, a series of outrageous misadventures and unexpected revelations unfold, turning the somber occasion into a chaotic and hilarious spectacle."
